gstein,2013-07-28 01:48:48,Oh I hear you We all want to be able to use and combine open free components into the stuff we build Totally agree on that part I simply question your belief that you cannot incorporate code into your LGPL or GPL combined works or do it in a heartbeat without worry Why do believe that your project cannot incorporate thus what is preventing you from using Bootstrap in your make this even more concrete say you use Bootstrap in your project Do you honestly believe the Bootstrap people are going to knock on your door and say violating the license we put onto Bootstrap you be using it that way Do you think they will that to downstream ,5.77125,1.5625,50.71875,3.8559375,2.255625,23.5,5.879375,2.0959375,22.875,5.8015625,1.6396875,19.0,5.785,1.526875,30.9375,3.5421875,2.2853125,8.28125,3.996875,2.20125,15.125,5.6615625,2.176875,11.09375,6.125,2.0228125,11.375,5.750625,1.639375,27.03125,5.8334375,1.396875,22.90625,3.705,2.3034375,10.25,3.9871875,2.218125,13.1875,5.9359375,2.3171875,12.21875,5.77125,1.755625,10.59375,5.7290625,1.613125,29.0625,5.8540625,1.4328125,21.65625,3.8125,2.4434375,9.65625,3.9634375,2.1728125,13.84375,6.146875,2.2078125,11.78125,5.5840625,1.8615625,11.09375
ZDroid,2013-07-28 10:50:33,Avoid this discussion as thing where you talk to law Here is place to chose to use or use MIT license in BS Greg Stein Oh I hear you github com We all want to be able to use and combine open free components into the stuff we build Totally agree on that part I simply question your belief that you cannot incorporate code into your LGPL or GPL combined works or do it in a heartbeat without worry Why do believe that your project cannot incorporate thus what is preventing you from using Bootstrap in your make this even more concrete say you use Bootstrap in your project Do you honestly believe the Bootstrap people are going to knock on your door and say violating the license we put onto Bootstrap you be using it that way Do you think they will that to downstream ,5.76894736842,1.54421052632,46.1578947368,3.85842105263,2.26342105263,23.0,5.87921052632,2.07289473684,22.0789473684,5.82447368421,1.59210526316,17.1052631579,5.76184210526,1.52947368421,28.2631578947,3.58947368421,2.24894736842,8.10526315789,3.96868421053,2.20763157895,14.8157894737,5.73052631579,2.14131578947,10.6842105263,6.05631578947,1.99868421053,11.0263157895,5.76657894737,1.62078947368,24.8684210526,5.78921052632,1.39078947368,20.5263157895,3.76684210526,2.31789473684,10.0789473684,3.94289473684,2.23394736842,12.8684210526,5.96421052632,2.27421052632,11.8157894737,5.74552631579,1.75157894737,10.2105263158,5.71157894737,1.60657894737,26.5526315789,5.86894736842,1.39105263158,19.6052631579,3.87394736842,2.44157894737,9.15789473684,3.935,2.17421052632,13.8421052632,6.13131578947,2.20289473684,11.3157894737,5.60921052632,1.81394736842,10.7631578947
jrobeson,2013-07-28 08:36:57,whether the problem is real or not i do know one thing The apache license is a blocker for using bootstrap in zencart themes and drupal themes both teams have made public statements regarding the usage of apache licensed components in their repositories If one wants to distribute a bootstrap based theme then person who installs the theme must acquire the bootstrap files and install them EDIT looks like i lied about the zencart statement being public for some reason this page on the forum is protected ,5.76434782609,1.61,22.8260869565,3.73869565217,2.22782608696,22.7826086957,5.86956521739,2.09608695652,20.6086956522,5.5947826087,1.53260869565,8.69565217391,5.8647826087,1.58608695652,13.6956521739,3.67086956522,2.24086956522,7.08695652174,3.78739130435,2.22217391304,15.5217391304,5.98347826087,2.14391304348,9.34782608696,5.81913043478,2.08043478261,11.0,5.70782608696,1.64956521739,13.3913043478,5.88260869565,1.3952173913,8.95652173913,3.70434782609,2.31913043478,10.0869565217,3.82260869565,2.21130434783,12.5217391304,5.80304347826,2.31434782609,11.3043478261,5.86434782609,1.69826086957,9.30434782609,5.7447826087,1.57260869565,13.8695652174,5.84434782609,1.52217391304,8.95652173913,3.75739130435,2.37260869565,10.1304347826,3.7547826087,2.11130434783,12.652173913,6.21608695652,2.22347826087,10.4782608696,5.50695652174,1.89217391304,10.1304347826
gstein,2013-07-28 09:34:56,no no a simple mistake rather than that term is much too harsh please worry Go ahead and ask those teams about the basis for their public statements Please see if you can find a or a of the problem with incorporating code into zencart or drupal be very In short is permissive so why do you believe it ,5.26470588235,1.55588235294,20.2941176471,3.75823529412,2.29117647059,22.1764705882,5.38588235294,2.11882352941,21.0,5.21882352941,1.59529411765,6.41176470588,5.30647058824,1.50352941176,13.2941176471,3.32411764706,2.23411764706,8.23529411765,3.97176470588,2.26764705882,13.8823529412,5.22764705882,2.27647058824,10.7647058824,5.51235294118,1.95294117647,10.1176470588,5.27294117647,1.66,11.8235294118,5.35647058824,1.46529411765,7.88235294118,3.42823529412,2.20470588235,9.52941176471,4.04470588235,2.30764705882,12.6470588235,5.41705882353,2.25941176471,12.4705882353,5.36058823529,1.95,8.52941176471,5.08941176471,1.53882352941,12.8235294118,5.58529411765,1.51588235294,7.47058823529,3.67882352941,2.48470588235,9.58823529412,3.89470588235,2.23764705882,12.5882352941,5.70764705882,2.27764705882,11.5294117647,5.02705882353,1.82529411765,9.47058823529
draftkraft,2013-07-28 10:29:28,imho the question is not whether YOU see any problem with integrating an into a project but whether there is a POTENTIAL legal issue because the situation is not clear vs Apache and the legal SECURITY for someone using a software that does integrate both licenses And that one a person or any if using such software runs into the RISK to use sell provide software or services with potential legal issues I agree that the bootstrap project in this case will not sue anyone if he does so their intension seems clear But any developer contributing to bootstrap COULD sue that one and further any competition of the one COULD sue him because they could accuse him to violate a license and distort competition The potential legal risk that arises from that fact could discourage someone or in doing it Think of Google Adobe and others even must not be such big global players could be local players will not use such software because they could end up in a legal conflict costing them millions of dollars euros whatever for lawyers penalties compensation etc Further the legal interpretation of the situation could be interpreted differently in every country Can you guarantee this will not I wonder why you are arguing that hard against that it you the one saying that this only blocks time that could be invested So the bootstrap projects has wisely chosen a way to avoid legal problems and provide legal secure That is Why are you blocking time of people continuously asking them for that took a decision based on their proprietary needs and keep telling the same thing without the will to understand or accept the situation or circumstances other or are acting ,5.40666666667,1.66833333333,22.962962963,4.01037037037,2.33574074074,22.962962963,5.56351851852,2.17333333333,21.1851851852,5.43981481481,1.70703703704,8.59259259259,5.39833333333,1.60833333333,13.962962963,3.93407407407,2.37148148148,7.75925925926,4.0337037037,2.29703703704,15.0740740741,5.53648148148,2.22611111111,10.0740740741,5.63685185185,2.0662962963,10.8148148148,5.42185185185,1.76055555556,12.8518518519,5.42555555556,1.46481481481,9.66666666667,4.02333333333,2.40277777778,9.96296296296,4.02018518519,2.30092592593,12.8888888889,5.61555555556,2.27796296296,11.5185185185,5.45796296296,1.98796296296,9.61111111111,5.36740740741,1.71555555556,13.4259259259,5.45759259259,1.58944444444,9.53703703704,3.90833333333,2.45648148148,10.1296296296,4.20703703704,2.20981481481,12.8333333333,5.78592592593,2.29481481481,11.037037037,5.36037037037,1.91962962963,10.1481481481
gstein,2013-07-28 10:57:24,Heh not blocking anybody could I hope or want Just hoping people stop think and understand what and why this course of action is being taken There are a lot of comments in this issue that lead me to believe there is a general misunderstanding of how code BSD gets combined into a larger work And that moving from to MIT somehow helps that purported Note my posts have consumed a couple hours of time This issue and its efforts have consumed at least hundred hours or more And it even complete btw you may want to read up on the cannot sue for license violation ,5.49833333333,1.70166666667,24.125,4.14625,2.4125,24.3333333333,5.64625,2.26125,24.0,5.2825,1.79375,9.41666666667,5.61375,1.57541666667,14.25,4.04,2.35333333333,8.79166666667,4.17958333333,2.44458333333,15.4583333333,5.565,2.27458333333,11.75,5.73916666667,2.34458333333,11.9166666667,5.34083333333,1.78125,13.75,5.78416666667,1.51083333333,9.79166666667,4.285,2.53458333333,10.7916666667,4.04375,2.31583333333,13.4583333333,5.71791666667,2.42,12.9583333333,5.59208333333,1.98666666667,11.0416666667,5.32,1.7175,14.875,5.83583333333,1.55958333333,9.25,4.175,2.40541666667,10.7083333333,4.23,2.3625,13.625,6.105,2.3525,13.2083333333,5.15458333333,2.0675,10.7916666667
gstein,2013-07-28 11:08:18,btw if like to talk about potential legal risks then I would ask you why the MIT license is It does not explicitly speak to any of the rights in USC You only that a court will interpret the MIT language favorably with respect to Modern licenses like and have taken into account the terminology and case law regarding recent copyright code ,5.63047619048,1.7080952381,20.619047619,3.76,2.34952380952,21.8571428571,5.87761904762,2.06904761905,20.0,5.39238095238,1.76333333333,7.33333333333,5.77285714286,1.57380952381,12.8571428571,3.76095238095,2.3819047619,8.42857142857,3.70952380952,2.33238095238,13.4285714286,5.80666666667,2.11380952381,9.7619047619,5.93285714286,2.02142857143,9.85714285714,5.56142857143,1.81857142857,11.7142857143,5.74238095238,1.51380952381,8.38095238095,3.65619047619,2.37666666667,10.0476190476,3.79666666667,2.32047619048,11.8095238095,5.8519047619,2.17666666667,11.0,5.83904761905,1.78619047619,9.0,5.53761904762,1.69380952381,12.619047619,5.82904761905,1.59857142857,8.0,3.92904761905,2.49857142857,9.38095238095,3.7519047619,2.26142857143,12.4761904762,5.96476190476,2.24380952381,10.9523809524,5.79761904762,1.83095238095,9.04761904762
jrobeson,2013-07-29 21:39:42,https drupal org node ,4.84,1.57,19.0,3.5,2.22,22.0,5.62,1.43,21.0,5.25,1.28,8.0,4.55,1.75,11.0,3.0,2.21,10.0,3.92,2.23,12.0,5.25,0.89,8.0,5.85,1.68,13.0,5.21,1.37,14.0,3.8,1.79,5.0,2.75,1.98,8.0,3.93,2.3,14.0,5.75,1.91,8.0,5.54,1.13,13.0,5.4,1.51,10.0,4.22,1.48,9.0,3.75,1.96,12.0,3.2,2.57,10.0,5.58,1.51,12.0,5.67,1.41,9.0
gstein,2013-07-29 23:09:50,thanks already saw that in a comment earlier but I took your pointer as an implicit request to post there so I did ,5.50166666667,1.655,20.6666666667,3.925,2.16833333333,21.3333333333,5.91,2.12166666667,21.6666666667,5.34833333333,1.82333333333,8.0,5.55,1.36833333333,12.5,4.04833333333,2.21166666667,8.5,3.81,2.14,12.8333333333,5.83166666667,1.87,9.0,6.1,2.13,12.5,5.53,1.52333333333,11.1666666667,5.53666666667,1.64666666667,9.33333333333,4.16833333333,2.18166666667,9.16666666667,3.735,2.155,12.1666666667,5.81166666667,2.16666666667,12.1666666667,6.18833333333,1.86166666667,9.33333333333,5.42333333333,1.5,11.5,5.615,1.71666666667,9.16666666667,3.94166666667,2.15833333333,10.1666666667,3.94,2.29666666667,11.1666666667,6.245,2.24333333333,12.1666666667,5.44333333333,1.75166666667,9.5
juthilo,2013-07-30 13:26:40,Just to keep up to date I have just sent out emails to all the people which included a URL to the form Motto clicks less than minutes Certainly did pay off in terms of incoming responses ,6.07857142857,1.85285714286,30.2857142857,3.89857142857,2.32857142857,29.4285714286,5.65,2.17142857143,29.0,5.65428571429,1.93571428571,10.8571428571,6.28142857143,1.80428571429,18.7142857143,3.94142857143,2.25714285714,10.1428571429,3.84571428571,2.3,19.1428571429,5.56714285714,2.34,13.0,5.78571428571,2.05571428571,15.4285714286,6.09285714286,1.98714285714,17.2857142857,6.17,1.48714285714,12.2857142857,3.94142857143,2.52428571429,12.7142857143,3.85857142857,2.22,16.5714285714,5.70714285714,2.41857142857,15.5714285714,5.59714285714,1.91,13.4285714286,6.04857142857,2.10571428571,17.2857142857,6.15285714286,1.44285714286,13.0,4.15428571429,2.58571428571,11.5714285714,3.67142857143,2.19142857143,17.8571428571,5.71285714286,2.30714285714,15.7142857143,5.52714285714,1.91,13.2857142857
pmclanahan,2013-07-30 13:57:19,IANAL But my take is that the Apache license is superior because it provides some patent protection The GPL seems to exist to force developers to adopt the license or force them not to use the software For something claiming freedom there seems to be a lot of force going around including attempting to force Bootstrap to adopt a license that is not of their choice My opinion is that if a project like Drupal wants to use truly free software perhaps they should set their software truly free had to avoid many libraries over the years because of the GPL so I just bring myself to be sympathetic especially since users of Drupal are in no way affected by this and can easily include Bootstrap themselves ,6.05875,1.63333333333,60.5833333333,4.13208333333,2.29875,26.4583333333,5.91583333333,2.20125,25.5,5.99625,1.58041666667,23.0416666667,6.15541666667,1.62166666667,36.8333333333,4.23458333333,2.26291666667,9.58333333333,4.07666666667,2.29125,16.75,5.74791666667,2.29166666667,12.2916666667,6.10041666667,2.04041666667,12.9583333333,6.03208333333,1.67541666667,30.5833333333,6.13541666667,1.54708333333,29.25,4.20875,2.42916666667,12.0,4.06375,2.26,14.375,5.86791666667,2.31916666667,14.0416666667,5.93375,1.97625,11.375,5.9675,1.64875,34.375,6.18333333333,1.52541666667,26.2083333333,4.18791666667,2.43208333333,12.75,4.07333333333,2.19083333333,13.7083333333,6.04583333333,2.30541666667,12.875,5.79708333333,1.97875,12.625
mainerror,2013-07-30 14:07:22,This issue is about migrating Bootstrap to the license not GPL license or some sort of APL vs GPL holy war ,4.5375,2.06,25.25,4.7225,2.51,25.0,5.0775,2.47,25.0,4.36,2.0375,11.75,4.6925,1.7475,13.5,4.7825,2.2275,10.0,4.6525,2.6225,14.75,5.135,2.57,10.75,5.0225,2.5325,14.25,4.7625,2.2825,14.25,4.28,1.6675,11.0,4.66,2.5525,12.0,4.7975,2.535,13.0,5.28,2.595,14.0,4.725,2.15,11.0,4.5275,2.15,15.5,4.685,1.8225,9.75,5.0125,2.425,13.25,4.445,2.36,11.75,5.3425,2.8825,12.0,4.8775,2.19,13.0
pmclanahan,2013-07-30 14:19:14,I know My comment was in regards to the GPL project attempting to force others to in some way modify their licensing or behavior to do what they feel is right I simply disagree The Bootstrap project chose a license that they liked and are now being asked to change it Software is licensed GPL in order to prevent certain classes of people from using it I just dislike all of that very much ,5.39277777778,1.69611111111,23.9444444444,4.02388888889,2.27111111111,23.8888888889,6.03055555556,2.06666666667,23.9444444444,5.16666666667,1.59444444444,8.66666666667,5.53055555556,1.705,14.8333333333,3.96777777778,1.99388888889,8.83333333333,4.04333333333,2.39277777778,15.0,5.74388888889,2.11444444444,11.1111111111,6.27388888889,1.93111111111,12.6111111111,5.38055555556,1.61611111111,13.6111111111,5.49333333333,1.65388888889,9.88888888889,4.17388888889,2.2,10.0555555556,3.91833333333,2.31166666667,13.7777777778,5.88888888889,2.20166666667,13.6111111111,6.29055555556,1.71166666667,10.1666666667,5.34,1.56555555556,14.3888888889,5.58722222222,1.76,9.55555555556,4.18944444444,2.38111111111,10.2777777778,4.02833333333,2.27944444444,13.6111111111,6.23111111111,2.28111111111,12.8333333333,5.83111111111,1.74277777778,11.1111111111
pmclanahan,2013-07-30 14:44:20,All that said contributed all of a single line change to Bootstrap so my opinion should likely not count for much and the vast majority seem cool with the change This is just me shaking my single tiny fist in the air ,5.54846153846,1.54230769231,21.0,3.90538461538,2.27461538462,22.4615384615,5.47153846154,2.24846153846,22.7692307692,5.37538461538,1.59307692308,7.76923076923,5.67538461538,1.54461538462,12.8461538462,3.90692307692,2.06307692308,8.76923076923,3.82846153846,2.34,13.6153846154,5.26769230769,2.27615384615,10.7692307692,5.69846153846,2.21076923077,11.6923076923,5.47384615385,1.61615384615,10.3076923077,5.73538461538,1.41153846154,10.3076923077,3.66230769231,2.03307692308,10.0,4.01692307692,2.30461538462,12.4615384615,5.43615384615,2.22230769231,12.6923076923,5.39,2.10230769231,10.0769230769,5.47769230769,1.49384615385,12.3076923077,5.64,1.61230769231,8.69230769231,4.09153846154,2.42,10.4615384615,3.75153846154,2.15538461538,12.0,5.62,2.29307692308,12.3076923077,5.38615384615,2.11538461538,10.4615384615
torstenfabricius,2013-07-30 16:05:47,Hi Paul what do you Do you dislike that the Bootstrap project is asked to which should allow certain classes of people to use it aswell default integration in MIT or LGPL software for or do you dislike that software is licensed GPL in order to prevent certain classes of people from using Torsten Am schrieb Paul McLanahan github com I know My comment was in regards to the GPL project attempting to force others to in some way modify their licensing or behavior to do what they feel is right I simply disagree The Bootstrap project chose a license that they liked and are now being asked to change it Software is licensed GPL in order to prevent certain classes of people from using it I just dislike all of that very much Reply to this email directly or view it on GitHub github com twbs bootstrap issues ,5.49576923077,1.65653846154,22.7692307692,4.01923076923,2.27115384615,23.0384615385,5.94692307692,2.09576923077,22.7307692308,5.31461538462,1.59115384615,8.88461538462,5.61961538462,1.63961538462,13.5,3.94615384615,2.04269230769,8.15384615385,4.04692307692,2.35730769231,14.7692307692,5.80923076923,2.08153846154,10.3846153846,6.07884615385,2.00615384615,12.1538461538,5.50653846154,1.63038461538,12.6153846154,5.59192307692,1.59769230769,9.76923076923,4.12538461538,2.23961538462,9.84615384615,3.95884615385,2.28,13.0769230769,5.87307692308,2.17807692308,12.3461538462,6.06615384615,1.82461538462,10.2307692308,5.43769230769,1.58730769231,13.6538461538,5.64653846154,1.67884615385,9.11538461538,4.18,2.36346153846,10.5,4.01576923077,2.26269230769,12.5384615385,6.12961538462,2.25384615385,11.5769230769,5.76807692308,1.85461538462,11.1538461538
pmclanahan,2013-07-30 17:05:48,I consider using the to be a class of people a bit of code choosing to be exclusive and therefore being excluded by their own decision also likely that they could safely include Apache licensed code without issue but a difference of opinion The of would I think be Drupal users or people developing with Drupal and in no way restricted by the Apache license As far as the project class they are the one who made the GPL choice Had they wanted to be able to include code licensed under other licenses have selected a different license I do dislike the latter I think applying the term to GPL licensed code is a bit of a misnomer in that you can use it w o modification but if you choose to change it then they force a licensing decision on you So while free in the beginning it takes away the freedom of future developers to license their own work as they choose This is why called a license It also quite often means that developers in corporations use the project Some like this aspect but rather err on the side of helping my fellow programmer than hurting companies The Apache license is extremely permissive for all uses but the GPL dislikes that where I see the difference The intricacies of are over my head just generally opposed to a project bending to the whim of a project simply because they chose a restrictive license that is now biting them back and because I like the Apache license MIT is also great but offers nothing in the realm of patents which are unfortunately a big deal these days Yes to both though I disagree with the wording of the former ,5.65277777778,1.68907407407,37.962962963,3.90925925926,2.28685185185,23.1111111111,5.83722222222,2.16425925926,21.2962962963,5.60314814815,1.72962962963,13.7777777778,5.69796296296,1.59833333333,23.5185185185,3.68814814815,2.29851851852,8.27777777778,4.00851851852,2.26092592593,14.7592592593,5.67037037037,2.25296296296,10.3333333333,6.01777777778,2.06296296296,10.7222222222,5.54981481481,1.76518518519,19.962962963,5.88666666667,1.50222222222,17.3333333333,3.84018518519,2.33444444444,9.92592592593,3.96407407407,2.28055555556,13.1481481481,5.89981481481,2.36222222222,11.4814814815,5.71481481481,1.85166666667,9.7962962963,5.53074074074,1.68685185185,22.1296296296,5.87055555556,1.61203703704,15.8333333333,3.93925925926,2.40185185185,9.74074074074,4.02703703704,2.25074074074,13.3703703704,6.08537037037,2.26925925926,11.0555555556,5.5737037037,1.94055555556,10.2407407407
marclaporte,2013-08-04 16:54:53,thanks for starting this thanks for recent push to get approvals from contributors Here are stats from the tracking spreadsheet as of now Number of contributors OK No Problem reaching them Waiting for answer are new contributors in and only recently have been Of those who answer agree For those who disagree of we can rewrite their contributions There are new committers all the time This is great but making this never ending Would there be a way to ask people to accept as they do their first ,5.95666666667,1.61523809524,25.3333333333,3.84428571429,2.39095238095,24.7142857143,5.66904761905,2.14904761905,24.0,5.90714285714,1.69523809524,8.90476190476,6.00047619048,1.50571428571,15.8095238095,3.77952380952,2.4219047619,8.80952380952,3.89523809524,2.38428571429,15.7619047619,5.44619047619,2.24047619048,11.8095238095,5.97523809524,2.02428571429,11.8571428571,5.8619047619,1.7280952381,14.380952381,6.1780952381,1.38571428571,10.3333333333,3.86904761905,2.43714285714,10.7142857143,3.85047619048,2.31714285714,13.9047619048,5.62428571429,2.35666666667,13.1904761905,5.68761904762,1.80571428571,10.7619047619,5.88285714286,1.58761904762,15.5238095238,6.09476190476,1.58047619048,9.80952380952,3.8419047619,2.64,11.1428571429,3.9680952381,2.24523809524,13.5714285714,5.86666666667,2.37666666667,13.3333333333,5.42666666667,1.82857142857,10.6666666667
pmclanahan,2013-08-05 01:53:14,Just to be clear while a vote I want to block the will of the majority Clearly a vast majority is cool with this so fine with that I just wanted to make my feelings known on the matter since you asked But if the will of the bootstrap contributor community then I stand in the way ,5.766,1.62866666667,21.8,3.83,2.276,20.9333333333,5.95133333333,2.17933333333,18.4666666667,5.81866666667,1.79533333333,7.46666666667,5.72266666667,1.60466666667,13.6666666667,3.856,2.38866666667,7.46666666667,3.74866666667,2.13533333333,13.4666666667,5.748,2.30866666667,8.6,6.226,1.992,9.2,5.66533333333,1.73933333333,13.2666666667,5.88533333333,1.37533333333,7.86666666667,3.99466666667,2.45266666667,9.53333333333,3.65866666667,2.142,11.4,5.94666666667,2.432,10.3333333333,5.88666666667,1.78533333333,8.13333333333,5.70466666667,1.62333333333,13.2666666667,5.836,1.618,8.53333333333,4.05866666667,2.52466666667,7.26666666667,3.63666666667,2.13533333333,13.6666666667,6.106,2.354,9.6,5.78266666667,1.89866666667,8.86666666667
marclaporte,2013-08-05 03:16:28,Thanks 
marclaporte,2013-08-05 04:09:34,So there was quite a bit of work on this today by Julian and myself The current tally stands at Number of contributors OK No new request was sent out and graciously accepted to change their Problem problems have been Wait are more recent contributors in and only have been contacted less than a week ago and we are waiting for the votes to come in ,5.56181818182,1.59,21.0,3.88727272727,2.25272727273,20.8181818182,5.66727272727,2.10909090909,18.6363636364,5.59181818182,1.48454545455,7.0,5.52454545455,1.61,13.3636363636,3.62181818182,2.48272727273,7.54545454545,3.99363636364,2.08818181818,13.2727272727,5.48727272727,2.27454545455,8.54545454545,5.84454545455,1.95272727273,9.81818181818,5.37545454545,1.66727272727,13.1818181818,5.94818181818,1.27090909091,7.18181818182,3.92818181818,2.42818181818,8.72727272727,3.88454545455,2.18181818182,12.0909090909,5.88636363636,2.30090909091,9.36363636364,5.44181818182,1.79818181818,9.27272727273,5.48,1.53727272727,13.0909090909,5.72909090909,1.54272727273,7.90909090909,4.06454545455,2.45090909091,8.18181818182,3.92636363636,2.17,12.6363636364,6.18,2.23636363636,10.0,5.11,1.70818181818,8.63636363636
cweagans,2013-08-05 04:17:46,like to point out a very important detail This is not a This is getting permission all or nothing ,6.104,1.508,24.8,4.156,2.218,20.6,6.384,1.888,18.4,6.002,1.684,10.0,6.268,1.294,14.2,4.03,2.434,6.8,4.22,2.168,13.8,6.494,1.796,9.0,6.374,1.912,9.2,5.884,1.594,13.0,6.434,1.292,11.4,3.982,2.136,8.6,4.308,2.32,12.0,6.466,2.066,10.0,6.254,1.706,8.4,6.034,1.708,14.2,6.264,1.182,10.6,4.324,2.622,8.0,4.156,1.966,12.6,6.498,2.13,9.0,6.234,1.724,9.4
pokonski,2013-08-05 09:17:23,Replied Great idea about migrating to MIT license ,6.48,1.88,22.0,4.68,2.51,30.5,6.45,2.085,31.5,6.545,1.475,10.0,6.78,1.84,12.0,4.69,2.21,11.0,4.645,2.695,19.0,6.015,1.985,13.5,6.77,2.16,18.0,6.8,1.645,11.5,6.11,2.055,10.5,4.535,2.365,15.0,4.82,2.72,15.0,6.105,2.335,16.5,6.83,1.675,15.0,6.75,2.09,12.5,6.155,1.46,9.5,4.915,2.175,15.0,4.7,2.715,15.5,6.435,2.49,15.0,6.525,1.845,16.5
